{
  "title": "Provider",
  "type": "object",
  "$schema": "http://json-schema.org/draft-06/schema#",
  "id": "",
  "required": [
    "id",
    "type",
    "name",
    "iconUrl",
    "verified",
    "website",
    "ipoStatus",
    "countryHQ",
    "countries",
    "webApplication",
    "mobileApps",
    "compliance",
    "sandbox",
    "developerPortalUrl",
    "apiStandards",
    "apiProducts",
    "ownership",
    "stateOwned",
    "stockSymbol",
    "investorRelationsUrl"
  ],
  "additionalProperties": false,
  "properties": { 
    "id": { 
      "type": "string", 
      "pattern": "[a-z0-9-]*$",
      "description": "Unique indentifier",
      "examples": ["abn-amro"]
    },
    "type": { 
      "type": "array",
      "items": {
        "enum": [
          "account",
          "third-party"
        ]
      },
      "description": "Provider type(s)",
      "examples": ["account"]
    },
    "bankType": { 
      "type": "array",
      "description": "Bank type",
      "examples": ["universal"],
      "items": {
        "enum": [
          "universal",
          "retail",
          "corperate",
          "challenger",
          "holding",
          "privatebank"
        ]
      }
    },
    "name": {
      "type": "string",
      "description": "Name of the provider",
      "examples": ["ABN Amro"]
    },
    "legalName": {
      "type": "string",
      "description": "ABN AMRO Group N.V.",
      "examples": ["ABN Amro"]
    },
    "verified": {
      "type": "boolean",
      "description": "Verified by company representative",
      "examples": [true]
    },
    "iconUrl": {
      "type": "string",
      "format": "uri",
      "pattern": "^(https?|http?)://",
      "description": "URL to the icon of the provider (recommended size 400x400)",
      "examples": ["https://res.cloudinary.com/banq/image/upload/v1552240551/radar/icons/abn-amro.jpg"]
    },
    "website": {
      "type": "string",
      "format": "uri",
      "pattern": "^(https?|http?)://",
      "description": "Website of the cloud service",
      "examples": ["https://www.abnamro.com/"]
    },
    "countryHQ": {
      "type": "string",
      "description": "Country (ISO ALPHA-2 code) of HQ",
      "examples": ["NL"]
    },
    "countries": {
      "type": "array",
      "description": "In what countries is the provider active",
      "examples": ["NL", "BE"],
      "uniqueItems": true
    },
    "webApplication": {
      "type": "boolean",
      "description": "Does this provider have a desktop application?",
      "examples": [true]
    },
    "mobileApps": {
      "type": "array",
      "items": {
        "type": "object",
        "properties": {
          "operatingSystem": {
            "enum": [
              "ios",
              "android"
            ],
            "examples": ["ios"]
          },
          "storeUrl": {
            "type": "string",
            "examples": ["https://itunes.apple.com/be/app/easy-banking-for-smartphone/id516502006"]
          }
        }
      }
    },
    "compliance": {
      "description": "Applicable regulations and compliance status",
      "type": "array",
      "items": {
        "type": "object",
        "required": [
          "regulation"
        ],
        "properties": {
          "regulation": { 
            "enum": [
              "PSD2",
              "OB",
              "GDPR"
            ]
          },
          "status": { 
            "enum": [ 
              "inProgress", 
              "ready", 
              "nonCompliant", 
              "unknown" 
            ]
          },
          "sourceUrl": {
            "type": "string",
            "format": "uri",
            "pattern": "^(https?|http?)://"
          }
        }
      }
    },
    "sandbox": {
      "type": "object",
      "properties": {
        "status": {
          "enum": [
            "available",
            "unavailable"
          ]
        },
        "sourceUrl": {
          "anyOf": [
            {
              "type": "string",
              "format": "uri",
              "pattern": "^(https?|http?)://"
            },
            { 
              "type": "null"
            }
          ]
        }
      }
    },
    "developerPortalUrl": {
      "anyOf": [
        {
          "type": "string",
          "format": "uri",
          "pattern": "^(https?|http?)://",
          "description": "Aplication url of the provider",
          "examples": ["https://developer.abnamro.com/"]
        },
        {
          "type": "null"
        }
      ]
    },
    "apiAggregators": {
      "anyOf": [
        {
          "type": "array",
          "uniqueItems": true,
          "items": {
            "enum": [
              "klarna",
              "token",
              "tink",
              "ibanity",
              "figo",
              "bud",
              "truelayer",
              "salt-edge",
              "nordic-api-gateway",
              "yolt",
              "plaid",
              "yapily"
            ]
          }
      },
      {
        "type": "null"
      }]
    },
    "openBankProjectUrl": {
      "anyOf": [
        {
          "type": "string",
          "format": "uri",
          "pattern": "^(https?|http?)://",
          "description": "Aplication url of the provider",
          "examples": ["https://developer.abnamro.com/"]
        }, 
        {
          "type": "null"
        }
      ]
    },
    "developerCommunityUrl": {
      "anyOf": [
        {
          "type": "string",
          "format": "uri",
          "pattern": "^(https?|http?)://",
          "description": "Aplication url of the provider",
          "examples": ["https://developer.starlingbank.com/community"]
        }, 
        {
          "type": "null"
        }
      ]
    },
    "slackCommunity": {
      "type": "boolean",
      "examples": [true]
    },
    "apiAuth": {
      "type": "array",
      "items": {
        "enum": [
          "OAUTH2",
          "OPENID-CONNECT",
          "UNKNOWN"
        ]
      },
      "examples": ["OAUTH2"]
    },
    "apiReferenceUrl": {
      "anyOf": [
        {
          "type": "string",
          "format": "uri",
          "pattern": "^(https?|http?)://",
          "description": "Aplication url of the provider",
          "examples": ["https://developer.abnamro.com/"]
        }, 
        {
          "type": "null"
        }
      ]
    },
    "apiStandards": {
      "description": "The supported standards",
      "type": "array",
      "items": {
        "enum": [
          "OBIE",
          "STET",
          "BERLIN"
        ]
      }
    },
    "apiAccess": {
      "description": "Is the API access limited to verified TPPs only",
      "anyOf": [
        {
          "enum": [
            "verifiedTpp"
          ]
        }, 
        {"type": "null"}
      ]
    },
    "apiProducts": {
      "type": "array",
      "items": {
        "type": "object",
        "required": [
          "label",
          "type",
          "categories",
          "description",
          "documentationUrl",
          "apiReferenceUrl",
          "premium",
          "stage"
        ],
        "properties": {
          "label": {
            "type": "string",
            "examples": ["Account information"]
          }, 
          "type": {
            "enum": [
              "accountInformation",
              "paymentInitiation",
              "paymentRequest",
              "fundsConfirmation",
              "atmLocator",
              "branchLocator",
              "productFinder",
              "cards",
              "consent",
              "auth",
              "fx",
              "other"
            ]
          },
          "specification": {
            "enum": [
              "OBIE-AISP",
              "OBIE-CBPII",
              "OBIE-PISP",
              "STET-AISP",
              "STET-CBPII",
              "STET-PISP",
              "BERLIN1.1",
              "BERLIN1.3"
            ]
          },
          "categories": {
            "type": "array",
            "items": {
              "enum": [
                "accounts",
                "payments",
                "funds",
                "cards",
                "loans",
                "locators",
                "products",
                "fx",
                "auth"
              ]
            }
          },
          "description": {
            "anyOf": [
              {
                "type": "string",
                "description": "Description of the API product",
                "examples": ["Initiate a single payment and retrieve information on the status of the transaction."]
              }, 
              {"type": "null"}
            ]
          },
          "documentationUrl": {
            "anyOf": [
              {
                "type": "string",
                "format": "uri",
                "pattern": "^(https?|http?)://",
                "description": "Aplication url of the provider",
                "examples": ["https://developer.abnamro.com/content/payment-initiation"]
              },
              {
                "type": "null"
              }
            ]
          },
          "apiReferenceUrl": {
            "anyOf" : [
              { "type": "string" },
              { "type": "null" }
            ],
            "examples": ["https://developer.abnamro.com/api/payment-initiation-v1/payment-initiation-documentation"]
          },
          "premium": {
            "type": "boolean",
            "description": "Is this a premium/paid API?"
          },
          "stage": {
            "enum": [
              "live",
              "sandbox",
              "privateBeta",
              "upcoming",
              "prototype",
              "idea",
              "unknown",
              "deprecated"
            ]
          },
          "customerTypes": {
            "type": "array",
            "items": {
              "enum": [
                "retail",
                "business",
                "corporate",
                "private"
              ]
            }
          },
          "countries": {
            "type": "array",
            "description": "In what countries is the API available",
            "examples": ["NL", "BE"],
            "uniqueItems": true
          },
          "rateLimits": {
            "type": "array",
            "description": "Rate limits that apply to this API",
            "items": {
              "type": "object",
              "properties": {
                "plan": {
                  "type": "string",
                  "examples": ["Default"]
                },
                "limit": {
                  "type": "string",
                  "examples": ["10 per second"]
                }
              }
            }
          }
        }
      }
    },
    "twitter": {
      "anyOf": [
        {
          "type": "string",
          "description": "Twitter handle",
          "examples": ["ABNAMRO"]
        },
        {
          "type": "null"
        }
      ]
    },
    "github": {
      "anyOf": [
        {
          "type": "string",
          "description": "Github organisation id",
          "examples": ["ABNAMRO"]
        },
        {
          "type": "null"
        }
      ]
    },
    "crunchbase": {
      "anyOf": [
        {
          "type": "string",
          "description": "Crunchbase organisation id",
          "examples": ["abn-amro-bank"]
        },
        {
          "type": "null"
        }
      ]
    },
    "fca": {
      "anyOf": [
        {
          "type": "string",
          "description": "FCA firm id",
          "examples": ["001b000000MfnaPAAR"]
        },
        {
          "type": "null"
        }
      ]
    },
    "ipoStatus": {
      "enum": [
        "public",
        "private",
        "subsidiary"
      ],
      "examples": ["public"]
    },
    "stockSymbol": {
      "anyOf": [
        {
          "type": "string",
          "description": "Stock market and ticker symbol",
          "examples": ["AMS:ABN"]
        },
        { 
          "type": "null"
        }
      ]
    },
    "investorRelationsUrl": {
      "anyOf": [
        {
          "type": "string",
          "format": "uri",
          "pattern": "^(https?|http?)://",
          "description": "Aplication url of the provider",
          "examples": ["https://www.abnamro.com/en/investor-relations/index.html"]
        }, 
        {
          "type": "null"
        }
      ]
    },
    "financialReports": {
      "type": "array",
      "items": {
        "type": "object",
        "required": [
          "label",
          "date",
          "url"
        ],
        "properties": {
          "label": {
            "type": "string"
          },
          "date": {
            "anyOf": [
              { "type": "string" },
              { "type": "null" }
            ]
          },
          "type": {
            "anyOf": [
              { "type": "null" },
              { 
                "type": "array",
                "items": {
                  "enum": [
                    "analystPresentation",
                    "annualReport",
                    "quarterlyReport",
                    "quarterlyInvestorPresentation",
                    "quarterlyPressRelease",
                    "annualPressRelease"
                  ]
                }
              }
            ]
          },
          "url": {
            "type": "string"
          }
        }
      }
    },
    "ownership": {
      "type": "array",
      "items": {
        "type": "object",
        "required": [
          "shareholderName",
          "shareholderIconUrl",
          "providerId",
          "percentage"
        ],
        "properties": {
          "shareholderName": {
            "anyOf" : [
              { "type": "string" },
              { "type": "null" }
            ]
          },
          "shareholderIconUrl": {
            "anyOf" : [
              { "type": "string" },
              { "type": "null" }
            ]
          },
          "providerId": {
            "anyOf" : [
              { "type": "string" },
              { "type": "null" }
            ],
            "description": "Use the id if this shareholder part of the radar directory"
          },
          "percentage": {
            "anyOf": [
              { 
                "type": "number",
                "minimum": 0,
                "maximum": 100,
                "multiplpeOf": 0.01
              },
              { "type": "null" }
            ]
          },
          "sourceUrl": {
            "type": "string",
            "format": "uri",
            "pattern": "^(https?|http?)://"
          }
        }
      }
    },
    "stateOwned": {
      "type": "boolean",
      "description": "Is this is a state-owned provider?",
      "examples": [true]
    },
    "dataBreaches": {
      "type": "array",
      "items": {
        "type": "object",
        "required": [
          "date",
          "url"
        ],
        "properties": {
          "date": { "type": "string" },
          "url": { "type": "string" }
        }
      }
    },
    "articles": {
      "type": "array",
      "items": {
        "type": "object",
        "required": [
          "url"
        ],
        "properties": {
          "date": { "type": "string" },
          "url": { "type": "string" }
        }
      }
    }
  }
}
