{
  "id": "kbc-bank",
  "type": ["account"],
  "bankType": ["universal"],
  "name": "KBC",
  "legalName": "KBC Group N.V.",
  "ipoStatus": "public",
  "verified": false,
  "iconUrl": "https://res.cloudinary.com/banq/image/upload/v1552296072/radar/icons/KBC.jpg",
  "website": "https://www.kbc.com/en",
  "ownership": [],
  "stateOwned": false,
  "countryHQ": "BE",
  "countries": ["BE","BG","HU","CZ","SK"],
  "compliance": [
    { 
      "regulation": "PSD2",
      "status": "inProgress"
    }
  ],
  "sandbox": {
    "status": "available",
    "sourceUrl": "https://www.kbc.com/system/files/doc/newsroom/pressreleases/2019/20190311_PR_DeveloperPortal_EN.pdf"
  },
  "developerPortalUrl": "https://developer.kbc-group.com/content/developer/kbc-be/en.html",
  "apiAuth": ["OAUTH2"],
  "apiProducts": [
     {
      "label": "Account Information Service (AIS)",
      "type": "accountInformation",
      "categories": ["accounts"],
      "description": "Access current account or credit card information (with your customer's explicit consent).",
      "documentationUrl": "https://developer.kbc-group.com/content/developer/kbc-be/en/apis/ais.html",
      "apiReferenceUrl": null,
      "premium": false,
      "stage": "sandbox",
      "specification": "BERLIN1.1"
    },
    {
      "label": "Payment Initiation Services (PIS)",
      "type": "paymentInitiation",
      "categories": ["payments"],
      "description": "Initiate an immediate payment to a SEPA-zone beneficiary (with your customer's explicit consent)",
      "documentationUrl": "https://developer.kbc-group.com/content/developer/kbc-be/en/apis/pis.html",
      "apiReferenceUrl": null,
      "premium": false,
      "stage": "sandbox",
      "specification": "BERLIN1.1"
    },
    {
      "label": "Confirmation of Funds (COF)",
      "type": "fundsConfirmation",
      "categories": ["funds"],
      "description": "Check availability of a KBC customer's current account or credit card funds (with their explicit consent).",
      "documentationUrl": "https://developer.kbc-group.com/content/developer/kbc-be/en/apis/cof.html",
      "apiReferenceUrl": null,
      "premium": false,
      "stage": "sandbox",
      "specification": "BERLIN1.1"
    },
    {
      "label": "Authorization API",
      "type": "auth",
      "categories": ["auth"],
      "description": "Compose & trigger authorization request. Get & refresh tokens. Security endpoints.",
      "documentationUrl": "https://developer.kbc-group.com/content/developer/kbc-be/en/apis/authorization.html",
      "apiReferenceUrl": null,
      "premium": false,
      "stage": "sandbox"
    }
  ],
  "apiStandards": [],
  "webApplication": true,
  "mobileApps": [
    {
      "operatingSystem": "ios"
    },
    {
      "operatingSystem": "android"
    }
  ],
  "stockSymbol": "EBR:KBC",
  "investorRelationsUrl": "https://www.kbc.com/en/investor-relations",
  "financialReports": [
    {
      "label": "Q4 2018",
      "date": "2019-02-14",
      "url": "https://www.kbc.com/nl/system/files/doc/investor-relations/Results/4Q2018/4Q2018_Quarterly_Report_en.pdf"
    }
  ],
  "twitter": "KBC_Group",
  "crunchbase": "kbc-bank",
  "github": null,
  "fca": "001b000000MfHWzAAN",
  "articles": [
    {
      "url": "https://newsroom.kbc.com/belgians-positive-towards-integrated-banking-app-kbc-mobile-gives-direct-access-to-current-accounts-held-with-other-banks",
      "date": "2018-03-05"
    }
  ]
}
