{
  "id": "abn-amro",
  "type": ["account"],
  "bankType": ["universal"],
  "name": "ABN Amro",
  "legalName": "ABN AMRO Group N.V.",
  "ipoStatus": "public",
  "verified": false,
  "iconUrl": "https://res.cloudinary.com/banq/image/upload/w_1000,ar_1:1,c_fill,g_auto,e_art:hokusai/v1552240551/radar/icons/abn-amro.jpg",
  "website": "https://www.abnamro.com/",
  "ownership": [
    { 
      "shareholderName": "NLFI",
      "shareholderIconUrl": "https://res.cloudinary.com/banq/image/upload/v1552255582/radar/icons/nlfi.png",
      "providerId": "NLFI",
      "percentage": 49.9
    }
  ],
  "stateOwned": true,
  "countryHQ": "NL",
  "countries": ["NL"],
  "compliance": [
    { 
      "regulation": "PSD2",
      "status": "inProgress"
    }
  ],
  "sandbox": {
    "status": "available",
    "sourceUrl": "https://medium.com/abn-amro-developer/psd2-sandbox-available-lets-get-started-5220d7e9418b"
  },
  "developerPortalUrl": "https://developer.abnamro.com/",
  "apiProducts": [
    {
      "label": "Account Information",
      "type": "accountInformation",
      "categories": ["accounts"],
      "description": "Retrieve details of an account such as balance transactions, balance and details.",
      "documentationUrl": "https://developer.abnamro.com/content/account-information",
      "apiReferenceUrl": "https://developer.abnamro.com/api/account-information-v1/account-information-documentation",
      "premium": false,
      "stage": "upcoming"
    },
    {
      "label": "Payment Initiation",
      "type": "paymentInitiation",
      "categories": ["payments"],
      "description": "Initiate a single payment and retrieve information on the status of the transaction.",
      "documentationUrl": "https://developer.abnamro.com/content/payment-initiation",
      "apiReferenceUrl": "https://developer.abnamro.com/api/payment-initiation-v1/payment-initiation-documentation",
      "premium": false,
      "stage": "upcoming"
    },
    {
      "label": "Tikkie Payment Request",
      "type": "other",
      "description": "Get paid faster by creating easy payment requests. Share them via any channel you want.",
      "categories": ["payments"],
      "documentationUrl": "https://developer.abnamro.com/content/tikkie-payment-request",
      "apiReferenceUrl": "https://developer.abnamro.com/api/tikkie-v1/tikkie-api-documentation",
      "premium": true,
      "stage": "live"
    },
    {
      "label": "Tikkie Fast Checkout (for Webshops & E-commerce)",
      "type": "other",
      "description": "Boost the conversion rate of your webshop by enabling customers to checkout in just a few seconds.",
      "categories": ["payments"],
      "documentationUrl": "https://developer.abnamro.com/content/tikkie-fast-checkout",
      "apiReferenceUrl": "https://developer.abnamro.com/api/tikkie-fastcheckout-v1/tikkie-fast-checkout-documentation",
      "premium": true,
      "stage": "live"
    },
    {
      "label": "Tweadle",
      "type": "other",
      "description": "Offer a responsible, clear and easy to use loan facility to your customers by allowing them to pay their purchase in monthly instalments.",
      "categories": ["loans"],
      "documentationUrl": "https://developer.abnamro.com/content/tweadle",
      "apiReferenceUrl": null,
      "premium": false,
      "stage": "privateBeta"
    },
    {
      "label": "Terminal Data",
      "type": "other",
      "description": "Receive data that has been generated by your Point Of Sale terminal during a transaction to automate your reconciliation.",
      "categories": ["payments"],
      "documentationUrl": "https://developer.abnamro.com/api/tikkie-v1/tikkie-api-documentation",
      "apiReferenceUrl": null,
      "premium": false,
      "stage": "prototype"
    },
    {
      "label": "Notification Kit",
      "type": "other",
      "description": "Receive webhook notifications for a wide range of use cases and automate banking processes when something changes on your account.",
      "categories": ["accounts"],
      "documentationUrl": "https://developer.abnamro.com/content/notification-kit",
      "apiReferenceUrl": null,
      "premium": false,
      "stage": "prototype"
    },
    {
      "label": "Check Kit",
      "type": "other",
      "description": "Validate client data for a wide range of use cases by getting a true or false response on topics like age, address and salary range.",
      "categories": ["accounts"],
      "documentationUrl": "https://developer.abnamro.com/content/check-kit",
      "apiReferenceUrl": null,
      "premium": false,
      "stage": "idea"
    }
  ],
  "apiStandards": [],
  "apiAggregators": [
    "klarna"
  ],
  "webApplication": true,
  "mobileApps": [
    {
      "operatingSystem": "ios",
      "storeUrl": "https://itunes.apple.com/nl/app/abn-amro-mobiel-bankieren/id439728011?mt=8"
    },
    {
      "operatingSystem": "android",
      "storeUrl": "https://play.google.com/store/apps/details?id=com.abnamro.nl.mobile.payments&hl=en"
    }
  ],
  "stockSymbol": "AMS:ABN",
  "investorRelationsUrl": "https://www.abnamro.com/en/investor-relations/index.html",
  "financialReports": [
    {
      "label": "Q4 2018",
      "date": "2019-02-13",
      "url": "https://www.abnamro.com/nl/images/Documents/050_Investor_Relations/Financial_Disclosures/2018/ABN_AMRO_Quarterly_Report_2018_Q4.pdf"
    }
  ],
  "twitter": "ABNAMRO",
  "crunchbase": "abn-amro-bank",
  "github": "ABNAMRO",
  "fca": "001b000000MfnaPAAR",
  "articles": [
    {
      "url": "https://medium.com/abn-amro-developer/psd2-sandbox-available-lets-get-started-5220d7e9418b",
      "date": "2019-03-05"
    }
  ]
}
