{
  "id": "citi",
  "type": ["account"],
  "bankType": ["universal"],
  "name": "Citi",
  "legalName": "Citibank, N. A.",
  "ipoStatus": "public",
  "verified": false,
  "iconUrl": "https://res.cloudinary.com/banq/image/upload/v1552641830/radar/icons/Citi.jpg",
  "website": "https://online.citi.com/US/login.do",
  "ownership": [],
  "stateOwned": false,
  "countryHQ": "US",
  "countries": ["GB","PL","RU"],
  "compliance": [
    { 
      "regulation": "PSD2",
      "status": "inProgress"
    },
    { 
      "regulation": "OB",
      "status": "ready"
    }
    ],
  "sandbox": {
    "status": "available",
    "sourceUrl": null
  },
  "developerPortalUrl": "https://sandbox.developerhub.citi.com/api-catalog-list",
  "apiProducts": [
    {
      "label": "Accounts",
      "type": "accountInformation",
      "categories": ["accounts"],
      "description": "Verify Citi customer accounts and grant your apps access to account data.",
      "documentationUrl": "https://sandbox.developerhub.citi.com/api/united-kingdom/accounts/overview",
      "apiReferenceUrl": "https://sandbox.developerhub.citi.com/api/united-kingdom/accounts/documentation",
      "premium": false,
      "stage": "sandbox",
      "countries": ["GB","PL"]
    },
    {
      "label": "Authorize",
      "type": "auth",
      "description": "Verify Citi customer accounts and grant your apps access to account data.",
      "categories": ["auth"],
      "documentationUrl": null,
      "apiReferenceUrl": "https://sandbox.developerhub.citi.com/api/united-kingdom/authorize/documentation",
      "premium": false,
      "stage": "sandbox",
      "countries": ["GB","PL"]
    },
    {
      "label": "Customers",
      "type": "accountInformation",
      "categories": ["accounts"],
      "description": "Get approved access to shared Citi customer profile data for deeper engagement.",
      "documentationUrl": "https://sandbox.developerhub.citi.com/api/united-kingdom/customers/overview",
      "apiReferenceUrl": "https://sandbox.developerhub.citi.com/api/united-kingdom/customers/documentation",
      "premium": false,
      "stage": "sandbox",
      "countries": ["GB","PL"]
    },
    {
      "label": "Money Movement",
      "type": "paymentInitiation",
      "categories": ["payments"],
      "description": "Give Citi customers the ability to move money across accounts and institutions.",
      "documentationUrl": "https://sandbox.developerhub.citi.com/api/united-kingdom/money-movement/overview",
      "apiReferenceUrl": "https://sandbox.developerhub.citi.com/api/united-kingdom/money-movement/documentation",
      "premium": false,
      "stage": "sandbox",
      "countries": ["GB","PL"]
    },
    {
      "label": "Utilities",
      "type": "other",
      "categories": ["products"],
      "description": "Allow developers to get country specific variations.",
      "documentationUrl": null,
      "apiReferenceUrl": "https://sandbox.developerhub.citi.com/api/united-kingdom/utilities/documentation",
      "premium": false,
      "stage": "sandbox",
      "countries": ["GB","PL","RU"]
    },
    {
      "label": "Onboarding",
      "type": "other",
      "categories": ["accounts"],
      "description": "Tap into the power of Citi acquisitions partner services.",
      "documentationUrl": "https://sandbox.developerhub.citi.com/api/poland/onboarding/overview",
      "apiReferenceUrl": "https://sandbox.developerhub.citi.com/api/poland/onboarding/documentation",
      "premium": false,
      "stage": "sandbox",
      "countries": ["PL","RU"] 
    },
    {
      "label": "Pay With Points",
      "type": "paymentInitiation",
      "categories": ["payments"],
      "description": "Enable your app to accept Citi customersâ€™ Citi rewards points to pay for their purchases.",
      "documentationUrl": "https://sandbox.developerhub.citi.com/api/russia/pay-with-points/overview",
      "apiReferenceUrl": "https://sandbox.developerhub.citi.com/api/russia/pay-with-points/documentation",
      "premium": false,
      "stage": "sandbox",
      "countries": ["PL","RU"] 
    }
  ],
  "apiStandards": [],
  "apiAggregators": [
    "klarna"
  ],
  "webApplication": true,
  "mobileApps": [
    {
      "operatingSystem": "ios",
      "storeUrl": "https://itunes.apple.com/us/app/citi-mobile/id301724680?mt=8"
    },
    {
      "operatingSystem": "android",
      "storeUrl": "https://play.google.com/store/apps/details?id=com.citi.citimobile&hl=en"
    }
  ],
  "stockSymbol": "NYSE:C",
  "investorRelationsUrl": "https://www.citigroup.com/citi/investor/pres.htm",
  "financialReports": [
    {
      "label": "Q4 2018",
      "date": "2019-01-24",
      "url": "https://www.citigroup.com/citi/news/2018/181220a.htm"
    }
  ],
  "twitter": "citi",
  "crunchbase": "citigroup",
  "github": "citi",
  "fca": "001b000000MfF27AAF",
  "articles": []
}
